{
  "context_sha256": "560b0f0d5b480c3b79864fcd9aeeb4fe88e0f0cede7257e327704c65ec80f30c",
  "coverage_delta": {
    "tool_req": {
      "fully_linked_pct": -50.0,
      "with_code_link_pct": 0.0,
      "with_test_link_pct": -50.0
    }
  },
  "executor": "snapshot_fixture_replay",
  "expected_verdict": "fail",
  "gate_passed": false,
  "gate_verdict_correct": true,
  "impacts_correct": true,
  "provenance": {
    "after_sha256": "d357324c2501b10d6786b7117be5f2328933dac6e9a41273c3a4d2fd352513d9",
    "before_sha256": "21bed59d1be418d358b522af3dfcfa6b940dd2b7dcbf67597ea70bcaade8be3a",
    "environment_hash": "0e04a9a344bdc358c403a1b20697448284641a05b8099ec384266617c6f84279",
    "escalation_role": "harness_maintainer",
    "execution_timestamp": "2026-10-07T15:12:54.021285+00:00",
    "gate_script_version": "0a8bf4201372e07198140032bcdbbacf70d63d4e47382ee8131e7369b25dfe71",
    "python_version": "3.12.12",
    "responsible_role": "pr_creator",
    "task_spec_sha256": "73edf3a49b1f9505514cbaeb2698114844c9eaaebb95d6a4a837399f0e194e2a",
    "waiver_authority": "release_approver"
  },
  "task_id": "search_022",
  "verdict_correct": true
}
