{
  "context_sha256": "2a13380d9707eeafe6143c4f050269435f54b8cb97757ece3c56090c41976632",
  "coverage_delta": {
    "tool_req": {
      "fully_linked_pct": 0.0,
      "with_code_link_pct": 0.0,
      "with_test_link_pct": 0.0
    }
  },
  "executor": "snapshot_fixture_replay",
  "expected_verdict": "pass",
  "gate_passed": true,
  "gate_verdict_correct": true,
  "impacts_correct": true,
  "provenance": {
    "after_sha256": "69fc35628aca6b348e8edd7c2289d192a1b4c7e7211d1f5cef55611a4dd027f9",
    "before_sha256": "def12c1e583b6549dff837f3a1fca1b1eb4654a20e517568f976eaf78a881112",
    "environment_hash": "0e04a9a344bdc358c403a1b20697448284641a05b8099ec384266617c6f84279",
    "escalation_role": "harness_maintainer",
    "execution_timestamp": "2026-10-07T15:01:57.248361+00:00",
    "gate_script_version": "0a8bf4201372e07198140032bcdbbacf70d63d4e47382ee8131e7369b25dfe71",
    "python_version": "3.12.12",
    "responsible_role": "pr_creator",
    "task_spec_sha256": "29e51f2fccaac025e6cfd3b8ad537a9a85b307f99fb5b1ea2b90bef35ab32534",
    "waiver_authority": "release_approver"
  },
  "task_id": "search_001",
  "verdict_correct": true
}
