{
  "context_sha256": "8c9229134bc733dbe7939d9b2c4bf55ec8cfb6f9641b289b3ac52952d2bea0b9",
  "coverage_delta": {
    "tool_req": {
      "fully_linked_pct": -50.0,
      "with_code_link_pct": -50.0,
      "with_test_link_pct": 0.0
    }
  },
  "executor": "snapshot_fixture_replay",
  "expected_verdict": "fail",
  "gate_passed": false,
  "gate_verdict_correct": true,
  "impacts_correct": true,
  "provenance": {
    "after_sha256": "514a6b2543715ade385ffad0c8b4f957b34993cf22141d49842e158665b11c1d",
    "before_sha256": "4c54a80e0ac8f735000edfdac4df3c39615b136ca125ef442acbc8c789053c3f",
    "environment_hash": "0e04a9a344bdc358c403a1b20697448284641a05b8099ec384266617c6f84279",
    "escalation_role": "harness_maintainer",
    "execution_timestamp": "2026-10-07T15:12:55.303921+00:00",
    "gate_script_version": "0a8bf4201372e07198140032bcdbbacf70d63d4e47382ee8131e7369b25dfe71",
    "python_version": "3.12.12",
    "responsible_role": "pr_creator",
    "task_spec_sha256": "d0c16bc7ac024a724557bfaabae5e4996097791cbe0aa34168648122fe371b45",
    "waiver_authority": "release_approver"
  },
  "task_id": "search_023",
  "verdict_correct": true
}
