{
  "context_sha256": "1c2b049eb73b1bf7ef6118e42c5e8bb3ce00e0cfdafcbff2bf83fb9e3eb320ac",
  "coverage_delta": {
    "tool_req": {
      "fully_linked_pct": 0.0,
      "with_code_link_pct": 0.0,
      "with_test_link_pct": 0.0
    }
  },
  "executor": "snapshot_fixture_replay",
  "expected_verdict": "pass",
  "gate_passed": true,
  "gate_verdict_correct": true,
  "impacts_correct": true,
  "provenance": {
    "after_sha256": "aca77e2562726a3d9456b0bada371e4fbd279b57ea10054fcdd7e8a045a7e72d",
    "before_sha256": "77341e8a96c8649f3272052bf9bea6a56b301395c3f77b0065f01fadcbc8ffa1",
    "environment_hash": "0e04a9a344bdc358c403a1b20697448284641a05b8099ec384266617c6f84279",
    "escalation_role": "harness_maintainer",
    "execution_timestamp": "2026-10-07T15:12:48.340628+00:00",
    "gate_script_version": "0a8bf4201372e07198140032bcdbbacf70d63d4e47382ee8131e7369b25dfe71",
    "python_version": "3.12.12",
    "responsible_role": "pr_creator",
    "task_spec_sha256": "af3a55a3f404a34c150d58bd02b15e76f2bbc9b4d9fd6d03186c9dbb01d4e26f",
    "waiver_authority": "release_approver"
  },
  "task_id": "search_017",
  "verdict_correct": true
}
