{
  "context_sha256": "e3b0c44298fc1c149afbf4c8996fb92427ae41e4649b934ca495991b7852b855",
  "coverage_delta": {
    "tool_req": {
      "fully_linked_pct": -50.0,
      "with_code_link_pct": 0.0,
      "with_test_link_pct": -50.0
    }
  },
  "executor": "snapshot_fixture_replay",
  "expected_verdict": "fail",
  "gate_passed": false,
  "gate_verdict_correct": true,
  "impacts_correct": true,
  "provenance": {
    "after_sha256": "ad5ac75c61436b4e09a90bd4cf2e8fcfff819599e42b4a3496b456a916578171",
    "before_sha256": "10326db0990f4f5d4f7bb982a6df379e2817f8b7fb0f8c914af6f1f3a0b08597",
    "environment_hash": "7bab1c0bdb7693fa14d49fe39089efa0be803440ef272854a376bd782c1aa0d0",
    "escalation_role": "harness_maintainer",
    "execution_timestamp": "2026-10-07T15:12:23.314965+00:00",
    "gate_script_version": "0a8bf4201372e07198140032bcdbbacf70d63d4e47382ee8131e7369b25dfe71",
    "python_version": "3.12.12",
    "responsible_role": "pr_creator",
    "task_spec_sha256": "356348c63d7cb85c9358f975265057d6385f380e79b946295c7c9738ccae9c1a",
    "waiver_authority": "release_approver"
  },
  "task_id": "heldout_009",
  "verdict_correct": true
}
