{
  "context_sha256": "e3b0c44298fc1c149afbf4c8996fb92427ae41e4649b934ca495991b7852b855",
  "coverage_delta": {
    "tool_req": {
      "fully_linked_pct": 0.0,
      "with_code_link_pct": 0.0,
      "with_test_link_pct": 0.0
    }
  },
  "executor": "snapshot_fixture_replay",
  "expected_verdict": "pass",
  "gate_passed": true,
  "gate_verdict_correct": true,
  "impacts_correct": true,
  "provenance": {
    "after_sha256": "b8eeb3eb1d8748ddbcd631a00b1415cfb79cb1a29a95f8f8a342eb273b8e362d",
    "before_sha256": "fc96b5525ee730ffba6c6ce3d9ea36db78053cb6055cca56314ea029ca49ca4f",
    "environment_hash": "7bab1c0bdb7693fa14d49fe39089efa0be803440ef272854a376bd782c1aa0d0",
    "escalation_role": "harness_maintainer",
    "execution_timestamp": "2026-10-07T15:12:18.977814+00:00",
    "gate_script_version": "0a8bf4201372e07198140032bcdbbacf70d63d4e47382ee8131e7369b25dfe71",
    "python_version": "3.12.12",
    "responsible_role": "pr_creator",
    "task_spec_sha256": "29b256c3ff715734d44153e7ef075999bc3da65cca68ee638e520c4f9f59e843",
    "waiver_authority": "release_approver"
  },
  "task_id": "heldout_004",
  "verdict_correct": true
}
