{
  "context_sha256": "2284f1238b8d93dc3a0f3d4607f708095b07743d6c385654a3a0b1f8861c0815",
  "coverage_delta": {
    "tool_req": {
      "fully_linked_pct": 0.0,
      "with_code_link_pct": 0.0,
      "with_test_link_pct": 0.0
    }
  },
  "executor": "snapshot_fixture_replay",
  "expected_verdict": "pass",
  "gate_passed": true,
  "gate_verdict_correct": true,
  "impacts_correct": true,
  "provenance": {
    "after_sha256": "5a3a91b5dc20157bdac2d6d190336fc1c8fba3d32e2992c9ccab1f57705202cb",
    "before_sha256": "113c64b403eef29d1f39e4e9d0ca8e4beacfbc95498ea166bde686e97156646b",
    "environment_hash": "0e04a9a344bdc358c403a1b20697448284641a05b8099ec384266617c6f84279",
    "escalation_role": "harness_maintainer",
    "execution_timestamp": "2026-10-07T15:01:59.828376+00:00",
    "gate_script_version": "0a8bf4201372e07198140032bcdbbacf70d63d4e47382ee8131e7369b25dfe71",
    "python_version": "3.12.12",
    "responsible_role": "pr_creator",
    "task_spec_sha256": "59ef371d85abd8c7aadd155fe9a61d2d5065073a5156b04527ee16a40d43c76a",
    "waiver_authority": "release_approver"
  },
  "task_id": "search_006",
  "verdict_correct": true
}
