{
  "context_sha256": "e3b0c44298fc1c149afbf4c8996fb92427ae41e4649b934ca495991b7852b855",
  "coverage_delta": {
    "tool_req": {
      "fully_linked_pct": 0.0,
      "with_code_link_pct": 0.0,
      "with_test_link_pct": 0.0
    }
  },
  "executor": "snapshot_fixture_replay",
  "expected_verdict": "pass",
  "gate_passed": true,
  "gate_verdict_correct": true,
  "impacts_correct": true,
  "provenance": {
    "after_sha256": "9c9fcaba2457a54b410af401fe806afab941c44ac8f51da16e9400dcfe8cf063",
    "before_sha256": "7927359ea722ba956f72014dc597c187ab6d3ef0acecee59345de7ee4fb7ce26",
    "environment_hash": "7bab1c0bdb7693fa14d49fe39089efa0be803440ef272854a376bd782c1aa0d0",
    "escalation_role": "harness_maintainer",
    "execution_timestamp": "2026-10-07T15:00:14.768450+00:00",
    "gate_script_version": "0a8bf4201372e07198140032bcdbbacf70d63d4e47382ee8131e7369b25dfe71",
    "python_version": "3.12.12",
    "responsible_role": "pr_creator",
    "task_spec_sha256": "23d30db410cc05390f6bea648d4aa1161bacfb50fe4f588f72bb33ccad0a6c3a",
    "waiver_authority": "release_approver"
  },
  "task_id": "search_021",
  "verdict_correct": true
}
